{
  "schema_id": "gait.voice.commitment_intent",
  "schema_version": "1.0.0",
  "created_at": "2026-02-15T00:00:00Z",
  "producer_version": "0.0.0-test",
  "call_id": "call_demo",
  "turn_index": 2,
  "call_seq": 5,
  "commitment_class": "quote",
  "utterance_digest": "1111111111111111111111111111111111111111111111111111111111111111",
  "currency": "USD",
  "quote_min_cents": 1200,
  "quote_max_cents": 3200,
  "evidence_reference_digests": [
    "2222222222222222222222222222222222222222222222222222222222222222"
  ],
  "context": {
    "identity": "agent.voice",
    "workspace": "/srv/contact-center",
    "risk_class": "high",
    "session_id": "sess_demo",
    "request_id": "req_demo",
    "environment_fingerprint": "envfp:voice"
  }
}
